{
  "format": 1,
  "language": "ru",
  "section": "story/janthir-wilds/prologue-the-tyrian-alliance",
  "strings": [
    {
      "id": 1117825,
      "en": "Firstborn Dagonet beckoned me home to the Grove. Thought things were going to quiet down after Nayos. I suppose that was optimistic.\n\n***",
      "ru": "Перворождённый Дагонет позвал меня домой, в Рощу. Казалось, после Найоса всё наконец утихнет. Пожалуй, это было слишком оптимистично.\n\n***",
      "context": "Герой → Журнал истории → Janthir Wilds → Prologue: The Tyrian Alliance. Вступительная запись за сильвари.",
      "src_hash": "4236dbc4d35e097b",
      "status": "reviewed",
      "evidence": "Community editor: contributions/ru/cdc359324a325b571be1b989.json",
      "verification": "Human translation reviewed and checked in-game in Hero > Story Journal > Janthir Wilds > Prologue: The Tyrian Alliance, 2026-10-23. Full paragraph fits and matches the reviewed text."
    }
  ]
}
